{
  "schema_version": "reproducibility-freeze-v1",
  "freeze_status": "partial",
  "observed_at": "2026-09-01T11:14:49Z",
  "evidence_states": {
    "realtime_verified": "Observed read-only during this freeze pass.",
    "historical_evidence": "Read from a named immutable prior-pilot artifact; not re-executed.",
    "pending": "Must be resolved and hashed before the selected-task run.",
    "unavailable": "Read-only verification was attempted but the component, command, or runtime was unavailable."
  },
  "host": {
    "state": "realtime_verified",
    "os": "macOS 26.5.1 build 25F80",
    "kernel": "Darwin 25.5.0 arm64",
    "architecture": "arm64",
    "git": "2.50.1 (Apple Git-155)",
    "workspace_head": "ee945d5a870d71246491419d58b09fb5a16498d7",
    "host_python": "3.10.16",
    "host_pip": "24.3.1",
    "node": "20.20.2",
    "npm": "11.15.0",
    "uv": "0.11.21"
  },
  "dependencies": {
    "status": "partial",
    "harbor_runtime": {
      "state": "realtime_verified",
      "python": "3.12.13",
      "lock_kind": "installed_distribution_snapshot",
      "clean_resolution_proven": false
    },
    "verifier_runtime": {
      "state": "realtime_verified",
      "python": "3.12.13",
      "lock_kind": "installed_distribution_snapshot",
      "clean_resolution_proven": false,
      "anomaly": "Duplicate pip distribution metadata (25.0.1 and 26.2.1) is preserved."
    },
    "formal_pipeline": {
      "state": "pending",
      "constraint_files_present": true,
      "hash_locked_resolution_present": false,
      "reason": "The current report/code tree is an unintegrated snapshot; its four requirement files are constraints, not a transitive lock."
    },
    "files": [
      {
        "path": "report/reproducibility/03_harbor_python.lock.txt",
        "sha256": "3f5453b75fcdc20d908593d4e010bd7b8845430ab8db153f95febc4b176e3a29",
        "role": "exact installed Harbor environment snapshot",
        "state": "realtime_verified"
      },
      {
        "path": "report/reproducibility/04_verifier_python.lock.txt",
        "sha256": "75dc03fc58021fa3cfbf5b23c4f714d97f9f20d257059eb435e25b20bbac6762",
        "role": "exact installed verifier/API environment snapshot",
        "state": "realtime_verified"
      },
      {
        "path": "report/code/pr_crawler/01_requirements_image_screening.txt",
        "sha256": "2dcfad4b6d9d09290df19bca77cb4f10f93517fd37888015b6df13a98a75151d",
        "role": "current optional parser constraint",
        "state": "realtime_verified"
      },
      {
        "path": "report/code/pr_crawler/08_requirements_vlm_screening.txt",
        "sha256": "070f7f72f6eb827e650604ea1daaaa2a84364f35d3516ea3dc9838daee942858",
        "role": "current VLM screening constraints",
        "state": "realtime_verified"
      },
      {
        "path": "report/code/pr_crawler/09_requirements_verifier.txt",
        "sha256": "ecb15c2ca47f54f9e22ab34a4bdfbfdfa96a1a518686d1dd53232fac721b3d46",
        "role": "current verifier constraints",
        "state": "realtime_verified"
      },
      {
        "path": "report/code/pr_crawler/10_requirements_api_engines.txt",
        "sha256": "a2888e20f9d15da0cbaa8e3bdd2fc804f816e7d5a8bf5a02ea639281020afde3",
        "role": "current API engine constraints",
        "state": "realtime_verified"
      }
    ]
  },
  "schemas_and_prompts": [
    {
      "path": "report/code/analysis/prompts/01_01_source_scope_verifier.system.md",
      "sha256": "1aca87dd1eb4e545fbbec61bcff244d2919e3b6c86128f4b75b1cccb4d055b21",
      "role": "bounded parent Issue source-scope system prompt",
      "state": "realtime_verified"
    },
    {
      "path": "report/code/analysis/prompts/01_02_source_scope_verifier.schema.json",
      "sha256": "99cb3dffd70deb279532994a8c4085dacdde404e516add383b4cc5a208508dc2",
      "role": "parent Issue source-scope output schema",
      "state": "realtime_verified"
    },
    {
      "path": "report/code/analysis/prompts/08_01_visual_context_screening.system.md",
      "sha256": "0db9a92027517e49dd4a292ab5fee29f2cc410e61025f676f6f344e99660b37a",
      "role": "visual content system prompt",
      "state": "realtime_verified"
    },
    {
      "path": "report/code/analysis/prompts/08_02_visual_context_screening.schema.json",
      "sha256": "a3fbb01c900c6b88ac6f1f7f9c3f895110e5b3cd03f0939d3eb43982c2070606",
      "role": "visual content output schema",
      "state": "realtime_verified"
    },
    {
      "path": "report/code/analysis/prompts/09_01_visual_verifier.system.md",
      "sha256": "f4d7b87f05f2793de04974b0dce8e0d94e1dec6fefa3fd246caddf8e8e0514b3",
      "role": "visual necessity system prompt",
      "state": "realtime_verified"
    },
    {
      "path": "report/code/analysis/prompts/09_02_visual_verifier.schema.json",
      "sha256": "4a952e684642124798027f62daca57529ab5e872beafbf558b69d5b0e6612939",
      "role": "visual necessity output schema",
      "state": "realtime_verified"
    },
    {
      "path": "report/code/analysis/prompts/12_01_repair_relation_verifier.system.md",
      "sha256": "3fb9a3445695c06d433431681d763ba2031032077d8f81bdaf849ffd21f70385",
      "role": "repair relation system prompt",
      "state": "realtime_verified"
    },
    {
      "path": "report/code/analysis/prompts/12_02_repair_relation_verifier.schema.json",
      "sha256": "ab15737374a823b980e4bd84c500566778e1de03ab294dc45fe963d97f56ecb1",
      "role": "repair relation output schema",
      "state": "realtime_verified"
    },
    {
      "path": "report/code/analysis/prompts/14_04_test_coverage_verifier.system.md",
      "sha256": "a7840367c0f9834e3fef3841765589b38c45749274e26962d12530c85f4b3f80",
      "role": "test coverage system prompt",
      "state": "realtime_verified"
    },
    {
      "path": "report/code/analysis/prompts/14_04_test_coverage_verifier.schema.json",
      "sha256": "30dffc0ff3ba7e04b762fd81e5708712899ddbe411dc7b3513150814c3438169",
      "role": "test coverage output schema",
      "state": "realtime_verified"
    },
    {
      "path": "report/code/analysis/prompts/16_01_text_only_repair_sufficiency.system.md",
      "sha256": "cf9310f5b3ba179ba3c3f92357211f26a8eb62efbf3f6c980d293f63ad1398f2",
      "role": "text-only sufficiency system prompt",
      "state": "realtime_verified"
    },
    {
      "path": "report/code/analysis/prompts/16_02_text_only_repair_sufficiency.schema.json",
      "sha256": "b91962edb8ae74df469245ddeaa26f6247fbb2e80297a5d26f5741a085b94b4c",
      "role": "text-only sufficiency output schema",
      "state": "realtime_verified"
    },
    {
      "path": "report/schemas/dual_human_calibration_v1.schema.json",
      "sha256": "e024ec178d0dd5b240e3d01ac3c2223887b16662e75e408d8896f1768dcc4a12",
      "role": "legacy minimal independent visual-necessity and F2P/P2P human calibration schema",
      "state": "realtime_verified"
    },
    {
      "path": "report/schemas/dual_human_calibration_v2.schema.json",
      "sha256": "d77157c6b34f5553a7fcb49b08c1c6b0ea835c39e7143fa9efab8d4c3b368717",
      "role": "bound detailed visual-necessity and per-test F2P/P2P human calibration schema",
      "state": "realtime_verified"
    }
  ],
  "harbor": {
    "installed_package": {
      "state": "realtime_verified",
      "version": "0.22.0",
      "editable": false,
      "direct_url_metadata": null,
      "source_commit_independently_bound": false
    },
    "source_revision": {
      "state": "historical_evidence",
      "repository": "harbor-framework/harbor",
      "commit": "d6514c49e3dc321df46c6653cb3ee8166ab12efe",
      "note": "Pinned by prior source audit; installed wheel metadata does not independently prove this commit."
    },
    "task_contract": {
      "state": "historical_evidence",
      "schema_version": "1.4",
      "mode": "single-step shared verifier",
      "reward_file": "/logs/verifier/reward.txt",
      "detail_file": "/logs/verifier/15_test_results.json",
      "required_layout": [
        "task.toml",
        "instruction.md",
        "environment/Dockerfile",
        "solution/solve.sh",
        "tests/test.sh"
      ]
    },
    "exam_task_contract": {
      "state": "realtime_verified",
      "schema_version": "1.2",
      "workdir": "/testbed",
      "asset_root": "/testbed/assets",
      "allow_internet": false,
      "reward_file": "/logs/verifier/reward.txt",
      "required_layout_source": "report/SUBMISSION_CONTRACT.md"
    },
    "prior_control_task": {
      "state": "historical_evidence",
      "repository": "bpmn-io/bpmn-js",
      "pr_number": 2322,
      "task_digest": "sha256:0a0561cbd72a12222b8b8dba2c65073f5bba43e8cc5d27e24a09493b20ff35a4",
      "baseline_reward": 0,
      "oracle_reward": 1,
      "controls_passed": 7,
      "not_reusable_as_selected_visual_task": true
    },
    "selected_visual_task": {
      "state": "material_changed_controls_pending",
      "repository": "carbon-design-system/carbon",
      "pr_number": 20978,
      "task_directory_checksum": "7a09fc4066c86f8b6df96d1b692cbd9a4daed3219d54889b2978154f1b09499e",
      "task_schema_compatibility_verified": true,
      "task_inventory": {
        "path": "report/reproducibility/06_selected_task_inventory.json",
        "sha256": "8c8d775bc9cf5cc682eb592964ea40a1708b97f560dce0626009157f811ca9aa",
        "tests": 8
      },
      "control_evidence": {
        "path": "report/evidence/oracle_summary.json",
        "sha256": "801893d48c85823dce6efed5670d58e319364dd0a653553045b5a76bd8e8e404",
        "status": "historical_checksum_rerun_required",
        "bound_historical_task_checksum": "2e4464f3d74f076f45c686133e3405b6d8674589d8407427b3b678cf52a1ad6b",
        "controls": 0,
        "baseline_reward": 0,
        "oracle_reward": 1
      },
      "negative_control_evidence": {
        "state": "historical_checksum_rerun_required",
        "path": "report/evidence/negative_controls_summary.json",
        "sha256": "8fb11e8348772f9d53ade1d4319da41671d2f72be57e0893e7298198e4e85e08",